{
  "schema_version": "0.1.0",
  "artifact_type": "foundational_record_index",
  "registry_type": "foundational_study_closeout_registry",
  "entries": [
    {
      "record_id": "LCMRP-FCLOSEREC-9901-SYNTHETIC-DRY-RUN-TAXONOMY",
      "record_version": 1,
      "artifact_type": "foundational_study_closeout",
      "schema_id": "urn:lcmrp:schema:foundational-study-closeout:0.1.0",
      "artifact_path": "records/foundational/closeouts/study-closeout.json",
      "artifact_digest": {
        "algorithm": "SHA-256",
        "value": "95a357cf97acd6cf465ebdb5365ddfa9d623c67551823c8d20be23293bc75f6c",
        "scope": "RAW_FILE_BYTES"
      },
      "registry_status": "ACTIVE",
      "registered_at": "2026-07-21T13:01:00Z"
    }
  ]
}
